{
  "_meta": {
    "schema_version": "1.0",
    "description": "Company API registry – metadata for all APIs (Telecom domain)",
    "last_updated": "2025-02-19",
    "maintained_by": "platform-engineering"
  },

  "teams": [
    {
      "id": "team-retail-api",
      "name": "Retail & Store APIs",
      "org_unit": "Consumer Business / Digital",
      "squad": "Store & Location Services",
      "slack_channel": "#retail-apis",
      "jira_project": "RETAIL"
    },
    {
      "id": "team-payments",
      "name": "Payments & Banking",
      "org_unit": "Finance & Operations",
      "squad": "Payment APIs",
      "slack_channel": "#payments-api",
      "jira_project": "PAY"
    },
    {
      "id": "team-identity",
      "name": "Identity & SIM",
      "org_unit": "Network & Identity",
      "squad": "SIM & KYC",
      "slack_channel": "#identity-apis",
      "jira_project": "ID"
    },
    {
      "id": "team-customer",
      "name": "Customer 360",
      "org_unit": "Consumer Business",
      "squad": "Customer Data APIs",
      "slack_channel": "#customer-apis",
      "jira_project": "CUST"
    }
  ],

  "developers": [
    { "id": "dev-001", "name": "Jane Doe", "email": "jane.doe@company.com", "role": "Tech Lead" },
    { "id": "dev-002", "name": "John Smith", "email": "john.smith@company.com", "role": "Backend" },
    { "id": "dev-003", "name": "Alice Chen", "email": "alice.chen@company.com", "role": "API Owner" },
    { "id": "dev-004", "name": "Bob Wilson", "email": "bob.wilson@company.com", "role": "Backend" },
    { "id": "dev-005", "name": "Carol Brown", "email": "carol.brown@company.com", "role": "Tech Lead" }
  ],

  "services": [
    {
      "id": "svc-store-locator",
      "name": "Store Locator Service",
      "logical_unit": "retail-store-locator",
      "description": "Microservice for store/outlet location and availability"
    },
    {
      "id": "svc-bank-check",
      "name": "Bank Check Service",
      "logical_unit": "payments-bank-check",
      "description": "Balance check and bank verification for payments"
    },
    {
      "id": "svc-sim-management",
      "name": "SIM Management Service",
      "logical_unit": "identity-sim",
      "description": "SIM swap, SIM status, and device binding"
    },
    {
      "id": "svc-customer-360",
      "name": "Customer 360 Service",
      "logical_unit": "customer-profile",
      "description": "Unified customer profile and status"
    },
    {
      "id": "svc-topup",
      "name": "Top-Up & Recharge Service",
      "logical_unit": "payments-topup",
      "description": "Prepaid top-up and recharge APIs"
    }
  ],

  "apis": [
    {
      "id": "api-store-location",
      "name": "Store Location API",
      "domain": "retail",
      "description": "Get store/outlet locations, opening hours, and availability by geography or filters.",
      "team_id": "team-retail-api",
      "developer_ids": ["dev-001", "dev-002"],
      "service_id": "svc-store-locator",
      "auth": ["API_KEY", "OAuth2"],
      "lifecycle": "GA",
      "tags": ["retail", "location", "stores", "outlets"],
      "environments": {
        "sandbox": "https://api-sandbox.company.com/retail/store-location",
        "staging": "https://api-staging.company.com/retail/store-location",
        "production": "https://api.company.com/retail/store-location"
      }
    },
    {
      "id": "api-bank-check-balance",
      "name": "Bank Check Balance API",
      "domain": "payments",
      "description": "Verify bank account and check balance for payment flows (top-up, bill pay).",
      "team_id": "team-payments",
      "developer_ids": ["dev-003", "dev-004"],
      "service_id": "svc-bank-check",
      "auth": ["OAuth2", "mTLS"],
      "lifecycle": "GA",
      "tags": ["payments", "banking", "balance", "verification", "PII"],
      "environments": {
        "sandbox": "https://api-sandbox.company.com/payments/bank-check",
        "staging": "https://api-staging.company.com/payments/bank-check",
        "production": "https://api.company.com/payments/bank-check"
      }
    },
    {
      "id": "api-sim-swaps",
      "name": "SIM Swap API",
      "domain": "identity",
      "description": "Initiate and query SIM swap requests; check swap eligibility and status.",
      "team_id": "team-identity",
      "developer_ids": ["dev-005", "dev-002"],
      "service_id": "svc-sim-management",
      "auth": ["OAuth2", "API_KEY"],
      "lifecycle": "GA",
      "tags": ["identity", "SIM", "swap", "fraud", "PII"],
      "environments": {
        "sandbox": "https://api-sandbox.company.com/identity/sim-swap",
        "staging": "https://api-staging.company.com/identity/sim-swap",
        "production": "https://api.company.com/identity/sim-swap"
      }
    },
    {
      "id": "api-customer-status",
      "name": "Customer Status API",
      "domain": "customer",
      "description": "Customer profile summary, account status, segment, and service eligibility.",
      "team_id": "team-customer",
      "developer_ids": ["dev-001", "dev-005"],
      "service_id": "svc-customer-360",
      "auth": ["OAuth2"],
      "lifecycle": "GA",
      "tags": ["customer", "profile", "status", "eligibility", "PII"],
      "environments": {
        "sandbox": "https://api-sandbox.company.com/customer/status",
        "staging": "https://api-staging.company.com/customer/status",
        "production": "https://api.company.com/customer/status"
      }
    },
    {
      "id": "api-topup",
      "name": "Top-Up / Recharge API",
      "domain": "payments",
      "description": "Prepaid airtime and data top-up, bundle purchase, and recharge history.",
      "team_id": "team-payments",
      "developer_ids": ["dev-003", "dev-004"],
      "service_id": "svc-topup",
      "auth": ["OAuth2", "API_KEY"],
      "lifecycle": "GA",
      "tags": ["payments", "topup", "recharge", "prepaid", "airtime"],
      "environments": {
        "sandbox": "https://api-sandbox.company.com/payments/topup",
        "staging": "https://api-staging.company.com/payments/topup",
        "production": "https://api.company.com/payments/topup"
      }
    }
  ],

  "api_versions": [
    {
      "id": "av-store-loc-v1",
      "api_id": "api-store-location",
      "semver": "1.2.0",
      "code_version_ref": "main@store-locator-svc",
      "doc_version_ref": "Confluence Store Location v1.2",
      "status": "current",
      "released_at": "2024-11-01"
    },
    {
      "id": "av-bank-check-v1",
      "api_id": "api-bank-check-balance",
      "semver": "1.0.0",
      "code_version_ref": "release/1.0@bank-check-svc",
      "doc_version_ref": "Confluence Bank Check v1",
      "status": "current",
      "released_at": "2024-09-15"
    },
    {
      "id": "av-sim-swap-v1",
      "api_id": "api-sim-swaps",
      "semver": "1.1.0",
      "code_version_ref": "main@sim-management-svc",
      "doc_version_ref": "Confluence SIM Swap v1.1",
      "status": "current",
      "released_at": "2024-10-20"
    },
    {
      "id": "av-customer-status-v1",
      "api_id": "api-customer-status",
      "semver": "2.0.0",
      "code_version_ref": "main@customer-360-svc",
      "doc_version_ref": "Confluence Customer Status v2",
      "status": "current",
      "released_at": "2025-01-10"
    },
    {
      "id": "av-topup-v1",
      "api_id": "api-topup",
      "semver": "1.3.0",
      "code_version_ref": "release/1.3@topup-svc",
      "doc_version_ref": "Confluence Top-Up v1.3",
      "status": "current",
      "released_at": "2024-12-01"
    }
  ],

  "endpoints": [
    {
      "id": "ep-store-search",
      "api_version_id": "av-store-loc-v1",
      "method": "GET",
      "path": "/v1/stores",
      "summary": "Search stores by location or filters",
      "operation_id": "searchStores"
    },
    {
      "id": "ep-store-by-id",
      "api_version_id": "av-store-loc-v1",
      "method": "GET",
      "path": "/v1/stores/{storeId}",
      "summary": "Get store details by ID",
      "operation_id": "getStoreById"
    },
    {
      "id": "ep-bank-verify",
      "api_version_id": "av-bank-check-v1",
      "method": "POST",
      "path": "/v1/accounts/verify",
      "summary": "Verify bank account and return balance",
      "operation_id": "verifyAccount"
    },
    {
      "id": "ep-sim-swap-request",
      "api_version_id": "av-sim-swap-v1",
      "method": "POST",
      "path": "/v1/sim/swap",
      "summary": "Submit SIM swap request",
      "operation_id": "requestSimSwap"
    },
    {
      "id": "ep-sim-swap-status",
      "api_version_id": "av-sim-swap-v1",
      "method": "GET",
      "path": "/v1/sim/swap/{requestId}",
      "summary": "Get SIM swap request status",
      "operation_id": "getSimSwapStatus"
    },
    {
      "id": "ep-customer-status",
      "api_version_id": "av-customer-status-v1",
      "method": "GET",
      "path": "/v2/customers/{customerId}/status",
      "summary": "Get customer account status and segment",
      "operation_id": "getCustomerStatus"
    },
    {
      "id": "ep-topup-execute",
      "api_version_id": "av-topup-v1",
      "method": "POST",
      "path": "/v1/topup",
      "summary": "Execute top-up for a subscriber",
      "operation_id": "executeTopup"
    }
  ],

  "sources_confluence": [
    {
      "id": "conf-store-loc",
      "api_id": "api-store-location",
      "space_key": "RETail",
      "page_id": "123456789",
      "page_title": "Store Location API",
      "labels": ["api-docs", "retail", "v1"],
      "version": 12,
      "url": "https://confluence.company.com/display/RETail/Store+Location+API"
    },
    {
      "id": "conf-bank-check",
      "api_id": "api-bank-check-balance",
      "space_key": "PAY",
      "page_id": "234567890",
      "page_title": "Bank Check Balance API",
      "labels": ["api-docs", "payments", "pii"],
      "version": 8,
      "url": "https://confluence.company.com/display/PAY/Bank+Check+Balance+API"
    },
    {
      "id": "conf-sim-swap",
      "api_id": "api-sim-swaps",